{
  "$schema": "../../schemas/extension-manifest.schema.json",
  "schemaVersion": 2,
  "kind": "profile",
  "id": "documentation-only",
  "version": "1.0.0",
  "starter": ">=0.1.0 <1.0.0",
  "name": "Documentation-only project",
  "description": "Keeps the process, architecture, quality, and agent documentation without generating an application runtime.",
  "surfaces": [],
  "files": "template",
  "requires": {},
  "conflicts": []
}
